{
  "mutation_id": "mut-1",
  "owner_review_packet_id": "or-1",
  "source_bundle_id": "wrb-20260721T155624Z-be643a429-sf54d1802",
  "reversible": true,
  "mutations": [
    {
      "product_id": "p1",
      "mutation_type": "set_category_handle",
      "before": {
        "category_handle": null
      },
      "after": {
        "category_handle": "krovati"
      },
      "rollback_value": {
        "category_handle": null
      },
      "before_fingerprint": "aaaaaaaaaaaaaaaaaaaaaaaaaaaaaaaaaaaaaaaaaaaaaaaaaaaaaaaaaaaaaaaa"
    }
  ]
}
